id,rating,text,date,version,platform
8ff1484a-cf88-440d-9d89-af63674e1ede,5,One of the best apps for stock and trade marketing.,2024-10-23,1.3.3,Android
f5e536f8-9493-400a-ad56-b37ca6a15140,5,good,2024-10-23,1.3.3,Android
b12459bc-c5b8-42c6-b7aa-777f44a842c1,5,good 👍,2024-10-23,1.3.3,Android
daccff77-8466-4a4b-964e-ebe6d62c94db,5,Best app for stock recommendation must try 🤌,2024-10-23,1.3.3,Android
421d77f9-d7b0-433f-a975-b6a09f94ed72,5,Wealth and best stock recommendation must try,2024-10-23,1.3.3,Android
2d2bd786-5a38-4957-9b38-9e03b4013b43,5,"Best wealth by using this app , secure and easy to understand, best investing app and easy to earn and security is good for our account.",2024-10-23,1.3.3,Android
1a12ea84-6e8a-471d-b18d-dcd2a9a9be28,5,Best for trade and best stock recommendation. Highly recommended.,2024-10-23,1.3.3,Android
36a1a8f0-c1e4-44f1-bcc4-426f78fd1a22,5,The app helps me to have an instant stock research. Great app,2024-10-23,1.3.3,Android
bcd1dc8d-7b9c-4e44-a39a-f9d6722259d2,5,overall good,2024-10-23,1.3.3,Android
1c910fed-74f2-40f7-a207-0d0253192b4a,5,Awasome,2024-10-23,1.3.3,Android
9b69b27f-e9a3-4396-a86d-91cf8759c9f8,5,Best stock and trade recommendations are provided here and the app is really very useful,2024-10-22,1.3.3,Android
c5156116-0216-4779-b8dd-6b3b077a99b5,1,If I could I would have given it a negative star. Such a useless application.,2024-10-22,1.3.3,Android
f417049a-36c1-451b-ab44-c6c730ec2a88,4,Liquide is a great app for managing wealth.Offline west stock recommendations and instead stock research stock calling inside provide to read,2024-10-22,unknown,Android
17de4b45-4b7d-48ed-82d7-73b3ad2b9c81,5,very good,2024-10-22,1.3.3,Android
c6ee88b2-6344-4997-98fd-d9aa867a8943,5,👍,2024-10-22,1.3.3,Android
4b3e3da7-79b7-44c5-b569-f2e982b5abcb,5,helpful in wealth management,2024-10-22,1.3.3,Android
19d5f348-4ea4-48d5-9d7e-911f1b11d968,5,Best stock recommendation instant stock research stock card insights trade recommendation,2024-10-22,1.3.3,Android
688397bd-6108-4bb7-a323-c94df8d72045,4,It shows the best stock recommendations and preferable trade recommendations overall it's a good application for stocks,2024-10-22,unknown,Android
fb44a762-4a2e-496a-bf63-691bbedb6d50,1,"Third class stock recommendation. Third class studys. Their suggested stocks sink to hell (fell down by more than 10% repeatedly). And then they remove it from their suggestions. It seems like their stock suggestions are for their profit booking only. No, ethics. I don't want their subscription. I am in loss only after following their recommendations. Please close my subscription and refund on pro-rated basis. I guarantee that their stock recommendation work in reverse order.",2024-10-22,1.3.3,Android
5bb5935e-d460-4717-97dc-e0003ebc5528,1,Worst review,2024-10-22,1.3.3,Android
95a450ee-2a3d-4c5c-9f46-63626887dc7e,5,Best for investment strategy.,2024-10-22,1.3.3,Android
0ecc1100-d37d-4d45-9ab2-b985b72c2055,5,Great trade recommendation,2024-10-22,1.3.3,Android
76c99b88-a1df-44a1-9e9a-9c7f4b9ed4cb,5,"I am recommending this app as it offers instant stock research and analysis, comprehensive market coverage and real time updates",2024-10-21,1.3.3,Android
349b6858-513d-494c-8502-62d7ef7e4681,5,This app has great stock market insights and has the best recommendations for trading.,2024-10-21,1.3.3,Android
7262fdc4-e6c1-428b-a9d1-95c7611e821e,5,"Liquide- Stocks and Mutual Funds is a user-friendly app offering seamless stock trading and mutual fund investments with real-time data and insightful tools. Great for managing portfolios, though advanced features may feel complex for beginners.",2024-10-21,1.3.3,Android
683dfead-8a33-4aba-9fce-9a94107f0770,5,very very well designed app and developed app,2024-10-21,1.3.3,Android
e6829c7c-8ace-481e-b298-7597c638356c,5,Good,2024-10-21,1.3.3,Android
89d38567-c012-43e2-8991-79418504d490,5,Great experience good wealth knowledge and fantastic stock recommendations.,2024-10-21,1.3.3,Android
e99c6b69-8e29-431c-883a-8cb0f149c0ba,5,One of the best Stock recommendation app I ever experienced.,2024-10-21,1.3.3,Android
d672490a-f495-474e-8117-7340e85ada39,1,"Worst app, don't download and waste your money😡",2024-10-21,unknown,Android
bd8d5e71-9edd-46e3-9d48-93c2dfaf817d,5,nace aplenty,2024-10-20,1.3.3,Android
b7969b0b-1def-48e6-a3f7-d0f7e1be27da,5,Good to see the share insight.,2024-10-20,1.3.3,Android
79000901-5d0a-43ec-b035-7080c8bc61fa,4,liquide is a great app for managing wealth offline best stock recommendations and instant stock research its stock card inside provide easy to read stock data entry recommendations,2024-10-20,1.3.3,Android
b29e2284-d9a5-404c-94c0-8afe69366272,5,ok,2024-10-20,1.3.3,Android
5e3d25e6-3232-4665-824a-dcb77741056f,5,"The Platform offers the best stock recommendations with instant stock research, insightful stock cards, and tailored trade recommendations.",2024-10-20,1.3.3,Android
4502cb38-9c41-4eb5-8f3a-1bd04aace3c0,5,very Good,2024-10-20,1.3.3,Android
3fdb4562-90c2-472f-a94f-cb04eec1f553,5,True investment partner.,2024-10-20,1.3.3,Android
3d79f57c-cfe0-41ef-946b-16f71667152f,5,"Good app, simple to use and quick",2024-10-20,1.3.3,Android
5e7e1fef-9f32-4cff-917e-5d9a6765671c,5,It's great👍 expireance for me,2024-10-19,1.3.3,Android
5a450acc-dd82-4272-93a7-0c9ede82ab3f,5,"One of the best app I have came across for trading and stock market, the user interface of this app is fab, and it helps you to grow your money with good plans and have amazing features. Must try",2024-10-19,1.3.3,Android
949014d0-1262-47c9-910c-480ebc9d2e4e,5,"Liquide aap offers a user-friendly interface and smooth navigation, making it easy to manage finances. Its real-time tracking and insightful analytics help users stay on top of their budgeting goals effectively.",2024-10-19,1.3.3,Android
8dfc9c5c-9522-4de7-b26d-dc932ed29083,4,One the best trading apps out there. It has a wide range of features that makes trading and investing efficient and user friendly.,2024-10-19,1.3.3,Android
ea7e26f0-bfa6-4ea8-b7d2-d0e012a89005,5,Found this app to be as an useful app. This app really helped to grow my wealth consistently. At last all I can say is that it is a Good for the traders as well as for the investors.,2024-10-19,unknown,Android
c626e00e-35d3-4512-a063-59f24f48cf5c,5,"A great app, as a beginner helped me a lot with stock card insights and instant stock research. Highly recommend it for best stock and trade recommendations.",2024-10-19,1.3.3,Android
62cc7155-ab2e-4667-9372-7d58858eec95,5,"With a user-friendly interface and comprehensive analysis tools, it empowers investors to make informed decisions quickly.",2024-10-19,1.3.3,Android
7b5a53ee-b117-49ff-9939-d1bef5b78b1e,1,"I am reviewing after at least 90 days of overall and 60 days of paid usage. The only star goes to the app Ui and marketing team. The Ux and Engineering team sucks. I am not even going into pain points like never arriving so called Ai report of the equity stocks you query LiMo, the assistant - but even basics like search Response box delay and extremely poor search algorithm resulting in minimum 10 secs to find a stock like Affle is - not even worth one Star. Plz pull up your socks for renewals.",2024-10-19,1.3.3,Android
39f5c53b-d49c-4457-b111-932ebb120a38,5,I like you,2024-10-19,1.3.3,Android
147b7b29-9449-49c8-ab6e-a6ba6834d0ee,5,Nice app,2024-10-19,unknown,Android
1a277b77-28cf-466d-af96-30ec4fe0b16e,4,Liquide app is very helpful and interesting! This app has the best stock recommendations and trade recommendations that is very helpful and i think the app and wealth promoting management is very important in my opinion for finance!,2024-10-19,1.3.3,Android
56805264-1531-4c79-ac48-9f910375eb3c,4,"Liquide is a great app for managing wealth, offering Best Stock Recommendations and Instant Stock Research. Its Stock Card Insights provide easy-to-read stock data, and Trade Recommendations help users make smart investment choices quickly. Perfect for investors seeking efficient and informed decision-making.",2024-10-19,1.3.3,Android
a85a92b4-f045-4161-94a2-d0eb7ea61ff4,4,It's a game changer app,2024-10-19,1.3.3,Android
80263d32-3924-430e-ac58-00235b830500,5,"good detailed educational content is provided, the real deal is the real active support team which solved every query at an instant regardless the time",2024-10-19,1.3.3,Android
69186dfe-64f2-4937-82cf-e6e9fd7574ef,1,"Wants money very badly, pushes you to buy coins or credits even before you get to know it...",2024-10-19,1.3.3,Android
ce2af0f6-87a8-4c95-ab56-07a37741a031,5,nice 👍 app,2024-10-19,1.3.3,Android
d95a1e85-1875-4c5c-acc2-638d3b839b82,1,"Very very bad app. Plz Dont wast your money in subscribe it. Only advertisement is big. No trade reserch. No target hit. Accuracy only 25%. When they give trade, They describes that stoploss and target. Target is not more than 2%. But when stock goes only 1% up. They says to sell stock and close the trade. When we ask they says that on market position we sell stock early. Only 1% return. Than what is earning? DP charge, other charges where? No proper baskets. Only Nifty-50 stocks and other stock",2024-10-19,1.3.3,Android
2bd23407-5f85-45a5-99c3-b74de2436028,5,"Best app for stock and portfolio check , very real and easy to handle loved it ❤️💯",2024-10-19,unknown,Android
45d844f8-2d6c-489d-af41-1fe67dee2d14,5,"wow, one page analysis not to go anywhere watch on only one click",2024-10-18,unknown,Android
9a9877ef-bb6f-4129-a080-270d7c93f132,5,"Liquide’s Stock Card Insights are incredibly detailed and easy to understand. They provide a clear picture of each stock, helping me make informed investment decisions. This feature alone makes the app stand out from the rest",2024-10-18,1.3.3,Android
16c014a0-b114-4c54-835b-e10341f1fc06,4,This app gives the best trade recommendations !!,2024-10-18,1.3.3,Android
2f4c00a3-59c4-4626-8236-fb654318d647,5,"Liquide is the best tool for managing my wealth. From instant stock research to personalized trade recommendations, this app offers everything I need to stay on top of the stock market. It's user-friendly and very informative!",2024-10-18,unknown,Android
eb5a1ca3-c430-44fc-8af2-25f23cb36bd9,5,I highly recommend this app nd it gives best stock recommendation and trade recommendations,2024-10-18,1.3.3,Android
3b77e522-b025-47b7-86d9-be5528b1d97d,5,This app is very good gives best stock recommendations and Trade recommendations,2024-10-18,1.3.3,Android
ee6ccfef-5efe-4be7-b51c-efb49ee784d5,5,Tested many apps but liquide is the best app and it gives best stock recommendations and gives instant stock reasearch,2024-10-18,1.3.3,Android
bdb5ba9e-111d-41e6-88fd-1bf84030f00d,5,Best stock research platform,2024-10-18,1.3.3,Android
cb8ad5b4-516f-438c-a881-eb3620343be7,1,App not working on s23fe model crashing everytime,2024-10-18,unknown,Android
ee80fe7d-2868-4048-acd9-4b2e616c518b,1,"Don't believe in their stats, by the time you will be notified to buy a trade, it will be in upper range. They always calculate profit from lower range price. They will say 2.3 % profit but in reality it is hardly 0.5%",2024-10-18,1.3.3,Android
79171bee-bdff-4359-aba1-159f90e6096c,5,Good experience,2024-10-18,1.3.3,Android
45de61eb-bd2c-4e41-ab2f-0c3339675558,5,Shatrughn Majhi Shatrughn money,2024-10-18,1.2.2,Android
d638d22a-173b-4f10-b04b-fb3d824e6300,5,good,2024-10-18,1.3.3,Android
bbc90e95-d6dd-40d9-9ba4-15b38448f5a9,5,Excellent Services for Everyone.,2024-10-17,unknown,Android
c42195db-3b30-46f2-b2f5-f3bebcad4055,5,ok,2024-10-17,1.3.3,Android
9e962f14-6a6f-4932-9fc2-9e875347dbd4,4,"This app has mindblowing attributes such that Instant Stock Research which has enhanced my understanding and management of both liquid stocks and mutual funds, making it an invaluable resource for any investor.",2024-10-17,unknown,Android
93e87b37-6d13-47b2-9344-1293f4be611a,5,Great app for mutual funds,2024-10-17,unknown,Android
65944b28-ae78-40b8-ac27-a231cacd7cc5,5,"Tried many apps,but liquide provide the best stock recommendation",2024-10-17,1.3.3,Android
22beb1d2-c020-4e45-b396-dee179baae7a,5,good,2024-10-17,1.3.3,Android
49a2303c-118a-4174-94e1-bf57948a1e1c,5,Very helpful and game changer,2024-10-17,1.3.3,Android
eff7cce2-bcc4-4ceb-bb14-14aaabb9f3f5,1,"I have bought the one membership, and I have been trying to connect my account since last 5-6 days its not connecting, everyday I am reaching out to their support the only message I get from them is they will look into this, and nothing happens. Worst experience.",2024-10-17,1.3.3,Android
af76a60e-2a59-4dc2-a1b7-235783c9ae91,5,Great deals,2024-10-17,unknown,Android
18df40cd-a30f-4a33-9c1f-c6deb8f5cb23,5,An easy to use app with various benefits,2024-10-17,1.3.3,Android
282b836c-6d43-47be-9e85-2ae20beb3198,5,very very good aap,2024-10-17,1.3.3,Android
6fc78a3b-2c39-433e-8e07-828e649bf458,5,best app to know about stock and very helpful for beginner,2024-10-17,1.3.3,Android
a298ab92-7e49-4c7a-80a4-3bb7324dd0b8,1,Purchased liquide membership for trade recommendations. Most of their trades hit stop loss or just 1 or 2 percent gains. They spam the whatsapp with their promotions than the trade recommendations and it annoying. I don't recommend using this app,2024-10-17,1.3.3,Android
22b59bd3-7fed-4fb3-9722-1a9df9b8db5f,5,Best,2024-10-16,1.3.3,Android
df68f15b-55a2-42cf-810a-bda911537d68,1,"Please don't waste your Hard-earned money in the, scam app.",2024-10-16,1.3.3,Android
3054845f-c071-437f-baf6-38497e6cf359,5,"If you're looking for the best stock recommendations and real-time insights, this platform is a game changer. With its instant stock research feature, you get access to well-analyzed wealth-building opportunities. The detailed stock card insights offer a clear view of potential investments, helping you make informed decisions. Whether you're a seasoned investor or just starting, the tailored trade recommendations ensure you stay ahead in the market. Highly recommended.",2024-10-16,unknown,Android
a6c559b8-a4fc-416e-b3c5-9b5f37f5d6cf,5,good information,2024-10-16,1.3.3,Android
9cd3a79e-2e11-4350-9627-e57060ab3349,5,very useful,2024-10-16,1.3.3,Android
959d56b6-466c-4a61-b8ad-f3d988936bb8,5,saves time gives money,2024-10-16,1.3.3,Android
87d94101-5da7-4d22-82db-ee27d2e2b666,3,"Not very effective app. Half of their predictions are false and they remove those from their records to show high accuracy. (Random guesses have 50% probability of being correct and that's what they are doing) Also, their backend is messed up. Most of the times fails to sync my portfolio with broker or fetch MF portfolio. Hire better developers at least.",2024-10-16,1.3.3,Android
84050c82-d799-4a6f-8464-546463d40109,5,nice,2024-10-16,1.3.3,Android
2d7b22cf-e009-4144-9189-6b1f83364b84,5,awesome,2024-10-16,1.3.3,Android
857dce84-2275-44ab-9cba-798d557c7832,5,nice,2024-10-16,1.3.3,Android
6dd4396b-03c0-4a61-8a5a-87301f8ff6cb,5,good,2024-10-16,1.3.3,Android
ea6fcd01-4846-435e-8a73-a0ac70d0d8d3,5,Wow nice user interface and overall good experience with the stocks results.,2024-10-16,unknown,Android
19cbc98a-702c-4106-b073-2969233ed140,5,Great app...,2024-10-15,1.3.3,Android
34ba29a4-944c-46f0-95b5-0b663cf8f874,5,Great app,2024-10-15,1.3.3,Android
0cb5e016-e1e6-40ec-ad4c-ae69e3259305,5,this app is very useful ✨,2024-10-15,1.3.3,Android
9db405b0-a513-4820-ba3d-92f110e87973,5,superb,2024-10-15,1.3.3,Android
31917de1-cb3b-4a15-8e0c-83e090b42a0f,3,You dont support linking Kotak Neo Securities as broker???,2024-10-15,1.3.3,Android
ca78146c-a1d0-4db3-9561-ab0fbd1f50fc,5,nice prediction,2024-10-14,1.3.3,Android
34bc4928-0bf4-4a9d-9ce3-8ab9f4443bca,5,Stock card insights and best stock recommendations,2024-10-13,unknown,Android
3c25e0f3-3844-40ec-aeee-804e739b34c6,5,great experience very good app,2024-10-13,1.3.3,Android
30cadc9e-d06e-4e51-918f-8618ae0d4e65,5,good,2024-10-13,1.3.3,Android
0b4e3c47-d947-495f-94a6-1e4157453e23,1,Random suggestions,2024-10-13,1.3.3,Android
affc2d06-b6ec-43a3-a75d-463847c3b25f,5,Wealth and best app for trade recommendations,2024-10-13,unknown,Android
414d4b10-e317-4b00-a4f1-d6a512f21e55,5,Wealth and trade recommendations,2024-10-13,unknown,Android
d0bfd77b-a9d1-4157-a8e5-12755e154ea8,5,Instant stock research pp,2024-10-12,unknown,Android
c56182f6-c36a-49ae-aa1a-464bb6abb303,5,Trade recommendations best app I have ever used,2024-10-12,unknown,Android
558409c5-68a2-468c-b04e-5145bbdafea4,5,Good one,2024-10-12,1.3.3,Android
639c40f2-0d25-4de4-873c-2752b267ed49,4,"I am changing my review from 1 start to 4 only because these guys improve a lot. Interface,UI everything is improved. Except some glitches with few stocks reports",2024-10-12,unknown,Android
4a426a78-d335-4dcf-b779-9fdabe730de6,5,stock card insights and trade recommendations,2024-10-11,unknown,Android
9464ac33-a8d4-4311-879e-5059ce6cb390,5,good service,2024-10-11,1.3.3,Android
7a858b6b-cd71-4637-9c9f-2e6f76c6560e,1,"Too much buggy app won't recommend and renew the liquide one anymore, number of issues with app already faced basket issue for long time and your team was unable to resolve I resolve it on my self by selling off the basket and reinvested again now facing issue with MF portfolio Need much improvement.",2024-10-11,unknown,Android
2130fd74-46a2-483e-8e17-2bad23eee905,5,good best experience,2024-10-11,1.3.3,Android
244961a3-e1ab-4b60-9918-e119e5bc14b4,5,Stock and insights with good investment and money maker app,2024-10-11,unknown,Android
115ab3b6-ff33-4c33-995d-bb085b0a2b0c,5,good,2024-10-10,1.3.3,Android
3a19e308-d629-469c-8e02-391244aa74e5,5,good,2024-10-10,1.3.3,Android
e0f96f8b-8bfe-4c73-8521-c767f127aea6,5,Best stock recommendations app,2024-10-10,unknown,Android
e3f807cc-98c4-49f9-a8cf-fe91bec5fa6d,5,Wealth and best stock recommendations,2024-10-10,unknown,Android
b92a032e-705d-4e49-bc1b-74694f5f3c97,5,fantastic,2024-10-10,1.3.3,Android
270f8ea5-4e9b-4fb2-b0db-34c7ea6eca3a,4,good,2024-10-10,1.3.3,Android
96c57976-f8ac-4c46-b038-1f8843436061,4,nice,2024-10-10,1.3.3,Android
f58ad754-5b7c-4957-b71e-a73b27eb5a79,5,THANK YOU 🙏😊,2024-10-10,1.3.3,Android
ee49f56c-56c5-4004-869d-c34e1b47e1aa,1,Nothing any special. Almost all short term trade are get in loss. Nothing find any valueabl benifits.,2024-10-10,1.3.3,Android
f2252aa9-4a40-44dc-b1b2-a58d5ed40951,3,"Liquid team is good, overall is also good but their promotion ads are really setback even you got their membership you are forced to watch it...and when you click on their notification on you mobile it takes you to that infor but again due to ads it got closes and then hard to find that notification about.... I am member from last 10 months.",2024-10-10,1.3.3,Android
d14ce6bf-7e4b-496f-a0a3-87498f8a3ecd,4,great and supportive app for beginners,2024-10-09,1.3.3,Android
5f637989-4312-4b6e-9127-3a4b5489375a,5,very quickkk,2024-10-09,1.3.3,Android
13217729569,1,Very expensive,2025-10-03,1.3.9,iOS
13214239378,5,"Good but always open eye in digital platforms like this one apps.
Liquide has many of the hallmarks of a promising and powerful investing tool. It blends analytics, AI support, portfolio diagnostics, alerts, and more into a cohesive package. For users who want guidance, insights, and curated ideas (without having to always build everything themselves), it offers a compelling value proposition.",2025-10-02,1.3.5,iOS
13213109146,5,Exactly what I needed to manage my portfolio better.,2025-10-02,1.3.5,iOS
13211841007,1,Worst,2025-10-01,1.3.5,iOS
13209684936,5,I’ve recently started using this app and it works amazingly for me. Best card insight and trade recommendations.,2025-10-01,1.3.5,iOS
13208811414,4,"Liquide App makes finance less intimidating, finally!",2025-10-01,1.3.5,iOS
13205107520,5,Great app for stocks and investing. It has such a user friendly interface that is really beneficial for beginners.,2025-09-30,1.3.5,iOS
13195294144,5,I’ve followed their best recommendations and seen consistent gains in my portfolio. love it!!,2025-09-28,1.3.5,iOS
13195087400,5,"Building wealth requires the right guidance, and this platform delivers exactly that. The stock card insights break down everything in a way that even beginners can understand. I especially appreciate their best stock recommendation and trade recommendations, which are based on solid instant stock research.",2025-09-28,1.3.5,iOS
13194999514,5,I feel like it is the best app in market as it provides great stock recommendations,2025-09-28,1.3.5,iOS
13194992027,5,This app had trade recommendations and I can do stock research,2025-09-28,1.3.5,iOS
13194985058,5,It is genuinely the best stock recommendation app,2025-09-28,1.3.5,iOS
13182654224,5,"I have been using it and the experience was great. Helpful for stock researches, highly recommended for beginners too",2025-09-25,1.3.5,iOS
13174538123,1,Wasted 4.5k and after buying they are asking to buy other plan and equity calls are also of no value ..either fetching 2% returns or stoploss….Giving delivery calls  for 10 days but after 10 days will ask you to book loss or exit at rate …,2025-09-23,1.3.5,iOS
13159690014,1,Nothing is working not even search bar also if you want to delete your profile they say it will take 30 days to delete and then only show option to logout. Its cheating,2025-09-19,1.3.5,iOS
13147159422,1,"I have bought paid Verizon. It’s not how they to the advertised.
Other apps are better and cheaper.",2025-09-16,1.3.5,iOS
13112284100,1,"Don’t use this app, wrong perceptions, and asking for recharge to use the app",2025-09-07,1.3.5,iOS
13109595637,1,Every time ask for money not even 1day free,2025-09-07,1.3.5,iOS
13098541210,5,Liquide App makes investing smarter with instant stock research and easy-to-digest stock card insights. A must-have for anyone seeking the best stock recommendation in seconds.,2025-09-04,1.3.5,iOS
13098179576,5,"The stock card insights are detailed, and I like how quickly I get instant stock research updates",2025-09-04,1.3.5,iOS
13073899102,5,User friendly interface,2025-08-29,1.3.5,iOS
13073648699,5,Liquide gives you instant stock research report and stock card insight. I totally recommend it to college students and working professionals,2025-08-29,1.3.5,iOS
13070811342,5,"I’ve been using Liquide for a few weeks and I’m genuinely impressed. The stock card insights make it so easy to understand a company’s performance at a glance. Their instant stock research feature saves me a lot of time, and the trade recommendations feel very practical. Definitely one of the best stock apps for building long-term wealth.",2025-08-28,1.3.5,iOS
13069904201,4,"Excellent app for investors!
Liquide provides smart stock insights and recommendations that really help in making better decisions",2025-08-28,1.3.5,iOS
13069027941,1,"This is just waste of money , none of the trades are successful. I lost most them 10k after following all there trades as they said",2025-08-27,1.3.5,iOS
13066905015,5,Liquide is a sleek user friendly investment app that simplifies stock market decisions with smart insights and real time guidance.,2025-08-27,1.3.5,iOS
13066657731,5,"Superb interface really love it. A very professional app, i’m searching for a platform which i can trust with my money and finally I found one.",2025-08-27,1.3.5,iOS
13065828022,5,"provides quick, reliable, and easy-to-understand insights for smart investing",2025-08-27,1.3.5,iOS
13062168435,2,"Well to be honest initially when I was consulted I was impressed but after few session of recommending strategy I realized that the team is not experienced to advice clients if the strategy is suitable for NRI ETC.  they will ask you to open and account in some other bank because the app does not connect with certain brokers or banks etc and it is absolutely annoying no solution was given apart from doing it manually, 
I do understand the nuisances with SEBI and regulations etc however I definitely feel lack of experience in the team, one more glorified app which is good but no use to
NRI clients and the teams needs to work to have solutions",2025-08-26,1.3.5,iOS
13057298602,1,Worst app Gives wrong recommendations every time,2025-08-24,1.3.5,iOS
13011281916,1,Faltu app.  Nonsense,2025-08-13,1.3.5,iOS
13006786689,2,"I have taken the annual subscription and when I get the notification on the mobile to invest in certain stock as the profit is rising by ‘X’ percentage, however when I click on the notifocation it takes me to the home page rather than taking to that particular stock suggestion. Also the black UI is very dull, please give an option to change it to white.",2025-08-12,1.3.5,iOS
12990263833,1,"Don’t fall for the polished UI. This app may look premium, but the numbers it shows are dangerously misleading. I cross-checked my portfolio on Liquide with my broker Zerodha — and to my shock, Liquide was showing a profit, while I was actually in a loss. Why? Because it was using outdated or incorrect stock prices.

In my case, the app showed an LTP of ₹327+ for JIOFIN, while the actual live price on Zerodha was ₹322. That ₹5 difference changed my P&L completely. Imagine taking a sell/buy decision based on this incorrect data — you’ll lose money.

This is not a one-time glitch. The app consistently lags in data and gives a false picture of gains or losses. It’s unacceptable for a financial app handling people’s hard-earned investments.

To anyone considering Liquide: don’t rely on it for real-time P&L or decision-making. Always trust your broker’s app or official sources like CDSL/NSDL.

Investing is already risky — don’t add another layer of risk with a misreporting app.",2025-08-08,1.3.5,iOS
